{
  "$schema": "https://sethmay.github.io/open-scout-api/schema/v1/council.schema.json",
  "id": "midnight-sun",
  "kind": "council",
  "versions": [
    {
      "valid_from": "2006",
      "valid_to": null,
      "name": "Midnight Sun Council",
      "bsa_number": 696,
      "hq_city": "Fairbanks",
      "hq_state": "AK",
      "website": "https://midnightsunbsa.org/",
      "states_served": [
        "AK"
      ],
      "territory": "territory:cst-1",
      "provenance": {
        "sources": [
          {
            "citation": "camp-finder council-696 (unofficial community dataset)"
          },
          {
            "citation": "Scouting America Council Service Territory 1 map (production 2026-06)"
          },
          {
            "url": "https://en.wikipedia.org/wiki/Scouting_in_Alaska"
          }
        ],
        "method": "imported",
        "verified_at": "2026-07-21",
        "confidence": 0.8
      }
    }
  ],
  "notes": null
}
