{
  "$schema": "https://sethmay.github.io/open-scout-api/schema/v1/council.schema.json",
  "id": "great-falls",
  "kind": "council",
  "versions": [
    {
      "valid_from": null,
      "valid_to": null,
      "name": "Great Falls Council",
      "bsa_number": 380,
      "hq_city": "Buffalo",
      "hq_state": "NY",
      "website": "https://gfcscouting.org/",
      "states_served": [],
      "territory": "territory:cst-10",
      "provenance": {
        "sources": [
          {
            "citation": "camp-finder council-380 (unofficial community dataset)"
          },
          {
            "citation": "Scouting America Council Service Territory 10 map (production 2026-06)"
          }
        ],
        "method": "imported",
        "verified_at": "2026-07-21",
        "confidence": 0.8
      }
    }
  ],
  "notes": null
}
