{
  "$schema": "https://sethmay.github.io/open-scout-api/schema/v1/council.schema.json",
  "id": "northwest-georgia",
  "kind": "council",
  "versions": [
    {
      "valid_from": null,
      "valid_to": null,
      "name": "Northwest Georgia Council",
      "bsa_number": 100,
      "hq_city": "Rome",
      "hq_state": "GA",
      "website": "https://www.nwgascouting.org/",
      "states_served": [
        "GA"
      ],
      "territory": "territory:cst-14",
      "provenance": {
        "sources": [
          {
            "citation": "camp-finder council-100 (unofficial community dataset)"
          },
          {
            "citation": "Scouting America Council Service Territory 14 map (production 2026-06)"
          },
          {
            "url": "https://en.wikipedia.org/wiki/Northwest_Georgia_Council"
          }
        ],
        "method": "imported",
        "verified_at": "2026-07-21",
        "confidence": 0.8
      }
    }
  ],
  "notes": null
}
