{
  "$schema": "https://sethmay.github.io/open-scout-api/schema/v1/council.schema.json",
  "id": "coastal-carolina",
  "kind": "council",
  "versions": [
    {
      "valid_from": null,
      "valid_to": null,
      "name": "Coastal Carolina Council",
      "bsa_number": 550,
      "hq_city": "Charleston",
      "hq_state": "SC",
      "website": "http://www.coastalcarolinabsa.org/",
      "states_served": [],
      "territory": "territory:cst-15",
      "provenance": {
        "sources": [
          {
            "citation": "camp-finder council-550 (unofficial community dataset)"
          },
          {
            "citation": "Scouting America Council Service Territory 15 map (production 2026-06)"
          }
        ],
        "method": "imported",
        "verified_at": "2026-07-21",
        "confidence": 0.8
      }
    }
  ],
  "notes": null
}
