{
  "$schema": "https://sethmay.github.io/open-scout-api/schema/v1/council.schema.json",
  "id": "chickasaw",
  "kind": "council",
  "versions": [
    {
      "valid_from": "1916",
      "valid_to": null,
      "name": "Chickasaw Council",
      "bsa_number": 558,
      "hq_city": "Memphis",
      "hq_state": "TN",
      "website": "https://chickasaw.org/",
      "states_served": [
        "TN",
        "AR",
        "MS"
      ],
      "territory": "territory:cst-14",
      "provenance": {
        "sources": [
          {
            "citation": "camp-finder council-558 (unofficial community dataset)"
          },
          {
            "citation": "Scouting America Council Service Territory 14 map (production 2026-06)"
          },
          {
            "url": "https://en.wikipedia.org/wiki/Chickasaw_Council"
          }
        ],
        "method": "imported",
        "verified_at": "2026-07-21",
        "confidence": 0.8
      }
    }
  ],
  "notes": null
}
