{
  "$schema": "https://sethmay.github.io/open-scout-api/schema/v1/council.schema.json",
  "id": "cradle-of-liberty",
  "kind": "council",
  "versions": [
    {
      "valid_from": "1996",
      "valid_to": null,
      "name": "Cradle of Liberty Council",
      "bsa_number": 525,
      "hq_city": "Philadelphia",
      "hq_state": "PA",
      "website": "http://www.scoutingphilly.org/",
      "states_served": [
        "PA"
      ],
      "territory": "territory:cst-13",
      "provenance": {
        "sources": [
          {
            "citation": "camp-finder council-525 (unofficial community dataset)"
          },
          {
            "citation": "Scouting America Council Service Territory 13 map (production 2026-06)"
          },
          {
            "url": "https://en.wikipedia.org/wiki/Cradle_of_Liberty_Council"
          }
        ],
        "method": "imported",
        "verified_at": "2026-07-21",
        "confidence": 0.8
      }
    }
  ],
  "notes": null
}
