{
  "$schema": "https://sethmay.github.io/open-scout-api/schema/v1/council.schema.json",
  "id": "southwest-florida",
  "kind": "council",
  "versions": [
    {
      "valid_from": null,
      "valid_to": null,
      "name": "Southwest Florida Council",
      "bsa_number": 88,
      "hq_city": "Fort Myers",
      "hq_state": "FL",
      "website": "http://www.swflcouncilbsa.org/",
      "states_served": [],
      "territory": "territory:cst-16",
      "provenance": {
        "sources": [
          {
            "citation": "camp-finder council-088 (unofficial community dataset)"
          },
          {
            "citation": "Scouting America Council Service Territory 16 map (production 2026-06)"
          }
        ],
        "method": "imported",
        "verified_at": "2026-07-21",
        "confidence": 0.8
      }
    }
  ],
  "notes": null
}
