{
  "$schema": "https://sethmay.github.io/open-scout-api/schema/v1/council.schema.json",
  "id": "sagamore",
  "kind": "council",
  "versions": [
    {
      "valid_from": "1972",
      "valid_to": null,
      "name": "Sagamore Council",
      "bsa_number": 162,
      "hq_city": "Kokomo",
      "hq_state": "IN",
      "website": "https://sagamorebsa.org/",
      "states_served": [
        "IN"
      ],
      "territory": "territory:cst-9",
      "provenance": {
        "sources": [
          {
            "citation": "camp-finder council-162 (unofficial community dataset)"
          },
          {
            "citation": "Scouting America Council Service Territory 9 map (production 2026-06)"
          },
          {
            "url": "https://en.wikipedia.org/wiki/Scouting_in_Indiana"
          }
        ],
        "method": "imported",
        "verified_at": "2026-07-21",
        "confidence": 0.8
      }
    }
  ],
  "notes": null
}
