{
  "$schema": "https://sethmay.github.io/open-scout-api/schema/v1/council.schema.json",
  "id": "ventura-county",
  "kind": "council",
  "versions": [
    {
      "valid_from": null,
      "valid_to": null,
      "name": "Ventura County Council",
      "bsa_number": 57,
      "hq_city": "Camarillo",
      "hq_state": "CA",
      "website": "http://www.vccbsa.org/",
      "states_served": [],
      "territory": "territory:cst-3",
      "provenance": {
        "sources": [
          {
            "citation": "camp-finder council-057 (unofficial community dataset)"
          },
          {
            "citation": "Scouting America Council Service Territory 3 map (production 2026-06)"
          }
        ],
        "method": "imported",
        "verified_at": "2026-07-21",
        "confidence": 0.8
      }
    }
  ],
  "notes": null
}
