{
  "$schema": "https://sethmay.github.io/open-scout-api/schema/v1/council.schema.json",
  "id": "pathway-to-adventure",
  "kind": "council",
  "versions": [
    {
      "valid_from": null,
      "valid_to": null,
      "name": "Pathway to Adventure Council",
      "bsa_number": 456,
      "hq_city": "Chicago",
      "hq_state": "IL",
      "website": "http://www.pathwaytoadventure.org/",
      "states_served": [],
      "territory": "territory:cst-6",
      "provenance": {
        "sources": [
          {
            "citation": "camp-finder council-456 (unofficial community dataset)"
          },
          {
            "citation": "Scouting America Council Service Territory 6 map (production 2026-06)"
          }
        ],
        "method": "imported",
        "verified_at": "2026-07-21",
        "confidence": 0.8
      }
    }
  ],
  "notes": null
}
