{
  "$schema": "https://sethmay.github.io/open-scout-api/schema/v1/council.schema.json",
  "id": "great-alaska",
  "kind": "council",
  "versions": [
    {
      "valid_from": null,
      "valid_to": null,
      "name": "Great Alaska Council",
      "bsa_number": 610,
      "hq_city": "Anchorage",
      "hq_state": "AK",
      "website": "https://scoutingalaska.org/",
      "states_served": [],
      "territory": "territory:cst-1",
      "provenance": {
        "sources": [
          {
            "citation": "camp-finder council-610 (unofficial community dataset)"
          },
          {
            "citation": "Scouting America Council Service Territory 1 map (production 2026-06)"
          }
        ],
        "method": "imported",
        "verified_at": "2026-07-21",
        "confidence": 0.8
      }
    }
  ],
  "notes": null
}
